7397,50,"Most of your knowledge of them comes from Catalina who being in the Dark Order longer had more information about them.  The Vampire Clans from what you know live in a fortress run by Lord Rostov. This fortress’ location is unknown and hidden by powerful magic. It is there where those few remaining vampires that have kept their faculties stay. (As opposed to the near mindless ones that lurk in holes in the wilderness)  While groups of vampires may have been involved in their own political intrigues and agendas in the past, the term Vampire Clans now is somewhat of a misnomer since Lord Rostov has a firm command over the remaining vampires. It’s basically a dictatorship more than a “council” where they all sit around discussing things. The term Clans is probably kept to just hold on to the illusion of former glory of freedom rather than the reality that they’re all hiding in a secret fortress ruled by a tyrant.  Despite their reduced power, they still can affect mortal affairs. Currently they are no doubt affecting these affairs to hinder you. The death of their delegate pissed them off pretty severely, not to mention they don’t agree with the “high profile” necromancy in the first place. You received a letter by bat from them recently saying that your actions will not go unopposed by the Clans and that your days on this world are numbered.   The self-professed “good guys” are made up of several civilized governments. The Zalan Empire (Your former home and where your family lives) is one of the main members of the Grand Alliance. Several races belong, each one bringing their unique skills to the mix. It’s quite possible to see the clockwork automatons of the Dwarven Union fighting side by side with the silent monks of Elin.  This arrangement only arises during times of great crisis such as the one you caused. Given that most living creatures have basic need to not want to die or become a walking rotting corpse (Or a slave to demons) the chances of you convincing them to leave you alone is extremely unlikely."
7397,51,"You might be a competent necromancer, but you’re leery about messing around with time. You better help Mr. Demar so he can better deal with the possible Quayle situation.  You head towards campus where various explosions are taking place, it doesn’t take long before you encounter Sebastian lying on the ground. You guess he attempted to help Mr. Demar and got killed for his troubles.  “Damn, sorry about that.” You say and then raise him to join your horde and hope Catalina is doing a better job with Quayle.  You enter the administration building. Smoke, fire and body parts look all around. In the distance you hear shouting followed by magic blasts.  “TRELIK YOU TREACHEROUS BASTARD!” “Ha ha! You’re weak old man and I’m taking over this shit!”  You order your undead horde to run ahead of you as you approach the sounds of battle. You turn the corner just in time for Trelik run into you, he’s definitely caught off guard.  “YOU! You little sycophant come to help teacher eh, well it won’t…”  You don’t listen to his melodramatic speeches, you tell your horde to kill him and they do so easily given that he’s heavily outnumbered and can’t cast a spell quick enough. Mr. Demar arrives just in time to see the aftermath.  “Damn, I was hoping to kill him myself. No matter, what’s done is done now. Our enemies here are defeated. Most of the high ranking professors have been killed, I’m just looking for that cowering Dean. Have you secured the city?” “Yeah, I personally stormed city hall and slew the first citizen and all of his mage guards.” “Ha ha! I knew you had potential!” Mr. Demar laughs and pats you on the shoulder. “Mr. Demar I think you should know something. Quayle’s spell is becoming erratic, someone said buildings are starting to phase in and out of existence. I think Jasmine’s over there, but I don’t think she’ll be able to handle what’s going on.” “Dammit, I’d hoped that Quayle was stable enough to…aaargh! Nevermind, I’ll have to take care of this, because if his actions go completely wrong we’re all dead. Since you seem to be good at killing high officials, you take care of the dean.”  Mr. Demar takes his leave towards the eastside of campus, leaving you to take out the dean. You’re a little unsure of yourself, the dean of the university didn’t get that way by being a push over. Though Mr. Demar did say he was cowering somewhere so maybe he’s not that tough. You tell your undead troops to spread out and search the building. Along the way you see Felsa’s body. Oh well, another follower for you…  You begin to grow tired of searching mundane office after mundane office so it’s a treat when you once again hear the sounds of battle and see the dean at the end of a corridor fighting off your horde.   “Back, foul things!” The dean shouts casting a ray of pure light in the faces of many of your troops.  He hasn’t seen you yet so you take advantage and cast your own blast of negative energy into his side. He falls in pain, but returns fire which you barely dodge. He crawls out of your line of sight and behind a corner.  “So Demar sends one of his students to take care of me, too cowardly to do it himself eh? It’ll take more than a few skeletons and a neophyte necromancer to bring me down! Come and get me if you dare!”  You have to kill him while he’s still weak, if you let him regain energy he could possibly escape, or worse, kill you."
7397,52,"You decide the best way is to take the straight forward approach and just overwhelm the dean. You raise more nearby bodies and add them to your tireless horde. As they march down the corridor, you stand near the end of the corridor figuring, if the dean comes out to cast a fireball he won’t get you. However you severely underestimated the dean.  He does indeed come out from behind the corner again and he casts a very powerful version of chain lightning, it zaps through your troops, not really doing anything except halting them briefly and rattling their dead bones, however when the lightning reaches YOU, you feel the effects a lot more severely as every organ in your body is fried and your skin is charred black.  You fall to the floor dead and your horde soon follows."
7397,53,"You always meant to try this, but never got around to it. No time like the present…  You concentrate and attempt to summon the spirits of the nearby dead to help you kill the dean. At first nothing seems to happen and you hear the dean killing more of your skeletons and walking corpses, but soon an eerie howl is heard.  Several tormented ghostly beings rise up and you give them the simple order to kill. It takes a bit more concentration to control them, but you manage. The dean is surprised by the ghosts and fumbles with an appropriate spell, but isn’t quick enough before they touch him and his life force begins to drain. Eventually he becomes a desicated husk and drops to the floor.  “Damn that was cool.” You giggle.  Feeling totally pleased with your victory, you then remember Mr. Demar and Quayle’s spell. You’d blocked it out of your mind during the battle, but you’re hoping that’s been resolved.  You head towards the eastside of campus, and you see no disturbance, at least no buildings disappearing and reappearing. You do see Catalina standing by though; she sees you and waves you over.  “Wow, you’re back, I guess that means you killed the dean huh?” Catalina questions. “You sound surprised.” “Hmm, I guess maybe I’m a little impressed.” “What’s going on?” “I dunno, I’m not sure myself, it was really weird. When I first got here I couldn’t get to Quayle due to all the temporal disturbances, I was about to leave when Mr. Demar arrived, he told me to stand back and he would take care of this. He managed to walk straight into that gray building over there where I assume Quayle was. I saw Mr. Demar become a child, a rotting corpse and then revert back to his normal age before he got there. I then heard terrible noises within. I even saw some strange tentacled creatures come out of the building. I thought I was going to have to fight them, but then the entire mess just seemed to stop and there wasn’t a disturbance anymore. I guess Mr. Demar won…but I haven’t checked on him, I’m still hesitant about going near there.” “Well I guess I’ll go in then.”  You enter the gray building cautiously, you see a bunch of little centipedes crawling all over the place, some really slimy yellow ichor and just a general feeling of sickness. You’ve seen a lot in the Dark Order, but whatever happened here was really fucked up.  You attention is turned to Mr. Demar who is on the floor…or rather IN the floor. Half of his body is embedded in the stone floor, you don’t see how you can help him.  “Shit! What the hell?” you exclaim. “Ugh…long story…look there isn’t much time. (Cough) This take over has been a failure.” “No it hasn’t, we got the whole city, I killed the dean, and you stopped this temporal disturbance…” “I haven’t stopped it, at least not permanently. The damage done was far too severe by the time I got here. Quayle’s actions have ripped open a hole to a place you don’t even want to know about. (Cough) I’ve temporarily patched it up, but who knows how long it will last. You better get out of here while you still can…I won’t lie though, life for you is going to be rough. You’ll be hunted when they find out what happened here and they WILL find out about you. They always do. Still, you may survive. You are powerful, maybe you’ll be able to succeed where I failed…but I doubt it. Ugh…the odds…just too great…you want my last advice? Take that Catalina girl and have fun while you can.”  And with that last bit of advice Mr. Demar dies.  Well this was a big downer. Here you thought you were ready to take on the world and then you find out all your actions have been for naught! Still, what does Mr. Demar know? He’s dead! Perhaps you can find a way to fix the hole permanently or at least keep it patched. It seems folly to just abandon this city after having risked so much to gain it.  Then again perhaps it would be better to follow Mr. Demar’s advice. If you leave now, it might take awhile before your identities are discovered. Life on the run isn’t going to be easy, but perhaps it won’t be forever."
7397,54,"You exit the gray building and approach Catalina, she looks at you expectantly.  “So what’re we going to do?” “We’re taking over this city. From now on, it’s you and me.” You reply.  Catalina is taken aback by your orders, given all of what has happened she senses that staying in the city wouldn’t be the best plan. But she has no other allies. She has no idea of where to run. She will stick with you, if only because together you’ll be a more formidable force when trouble surely arises.  You and Catalina prepare yourselves for the trouble ahead…  A month passes The Incident of Nuro has finally become well known knowledge. You and Catalina have managed to shore up the defenses of Nuro pretty well, all things considered. Some of the demonologists help out, but only because they have nowhere else to go and this is the safest place for them. You begin to instruct them to learn the ways of necromancy. You also manage to turn back a Grand Alliance army which didn’t expect such a large resistance. The demons that left the city ran amok all over the countryside and took a particular interest in the Kingdom of Tulan under the guidance of Velzix, an arch fiend. Which is fortunate since it draws a little attention away from you.  No signs of that “temporal hole” opening up again, but you tell some of your new acolytes to keep an eye on it. In the mean time nothing of importance is to be placed in that area.  A year passes The Kingdom of Tulan has finally put the sword to every last demon infesting the area, which doesn’t bode well for you since now you’re the only “big evil” around now.  The Grand Alliance attempts another siege of the city and once again they fail. You aren’t confident you can hold out forever like this though, you attempt to claim that you have no plans for conquest, but your claims (true or not) go unheeded. They aren’t taking any chances that you might build up.  You and Catalina have at this point basically become “King and Queen” of the city. It’s a logical pairing. Sometimes though it’s more than just one of convenience.  Your acolytes warn you about seeing strange things. Object temporarily disappearing. You begin to worry and unlock those old tomes that Quayle was reading hoping you can learn something.  Another years passes You suffer two more attacks by the Grand Alliance. The last one lead by your own sister. You attempted to parley with her before battle, but she would have none of it. Indeed you received a letter from your Mom a month before the attack begging you to give yourself up. Of course you couldn’t do that. You wrote her back with regret and told her that you shall probably not speak again.  Your sister got farther than most, but in the end she died by your own hand. You didn’t raise her. She was not deserving of such a fate. You burned her body instead and wished her well in the afterlife.  How you wished that your Dad’s mercenary company had been sent, but for whatever reason you have not heard anything from him. The coward. He knows you are more powerful and could easily crush him.  The temporal disturbances are getting worse, and you’re not learning anything new from Quayle’s books, it’s all just so damn confusing. You feel like you did when you were in school. Completely inept and helpless.  Catalina tries to be understanding, but your behavior from reading the damn books is making you very erratic. She has to pick up the slack when you begin to make mistakes.  Another year passes   The temporal hole rips open once again. Horrible creatures come lurching out. You manage to fight them off, but the hole is getting bigger. Catalina insists that you both have to leave the city, but you’re too far gone at this point, the books on temporal magic have begun to make you as mad as they did Quayle. (If without the talent) This is your city and you’re bound and determined to hold it no matter what.  She cannot endure anymore; she takes her leave of you one night…only to be killed by vampire assassins somewhere in the countryside.  The Grand Alliance is preparing to attack again, more tentacle creatures are seeping into this reality. You don’t care; you’ll take them all on.  You laugh insanely on your throne as the screams and unnatural howls fill the city. Battle and death is everywhere. You hear something coming up the stairs, and it’s probably not Grand Alliance soldiers…  “What was the point of it all? Nothing!” you laugh before being utterly destroyed."
7397,55,"You exit the gray building and approach Catalina, she looks at you expectantly.  “So what’re we going to do?” “We’re getting out of here, and we’re not looking back. From now on, it’s you and me.” You reply.  Catalina is taken aback by your orders, but given all of what has happened she senses that staying in the city wouldn’t be the best plan. She too has no other allies. She will stick with you, if only because together you’ll be a more formidable force when trouble surely arises.  You and Catalina leave the decimated city of Nuro behind you…   A month passes The Incident of Nuro has finally become well known knowledge. A few demonologists attempted to run the hollow shell of the city, but severely lacked any sort of manpower, natural or unnatural to hold it. They were easily defeated when the Grand Alliance army came to retake the city. The demons that left the city ran amok all over the countryside and took a particular interest in the Kingdom of Tulan under the guidance of Velzix, an arch fiend.  You and Catalina still remain unknown as far as being involved, but other members of the Dark Order that escaped are starting to be hunted down…  A year passes The Kingdom of Tulan has finally put the sword to every last demon infesting the area. Most of the demonologist have been caught and hung for their crimes as well. Your name has also come up on the wanted list along with Catalina’s.  You both now keep to the rural locations; many times you have to fend off attacks from barbaric orc tribes. Fortunately your skills in necromancy protect you (as well as scare the hell out of the orcs)  Despite the hardship (Or perhaps because of it) you and Catalina form a sort of relationship beyond one of just mutual protection. There are times when you forget that you’re being hunted constantly.  Two years pass Just like Mr. Demar predicted a temporal disturbance in the city of Nuro reappears again. Horrible creatures come lurching out creating a “Second Incident” before the time hole is repaired for good. However the city is evacuated due to mass insanity caused there and is considered a danger zone under observation by the Grand Alliance.  Catalina is killed by vampire assassins during the night, you take vengeance, but it’s too late for her. You weep for the first time in a long time. You briefly flirt with the idea of raising her…but you burn her body instead and carry on your path alone.  And all you can think about is how tired you are…  Two more years pass You hear them coming for you, there is no more running. This is your fate. To die in this cave. You don’t even want to fight it anymore. You regret the day you set out on this path.  Such is often the fate of a necromancer."
7397,56,"Sensing impending doom, you decide your best course of action is to escape. You immediately take your undead horde and fight your way out of the city. You then attempt to put as much distance as you can between you and Nuro. You curse the day you decided to fuck around with the dark arts. Where are you going to go now? You have no idea, but you can’t be seen walking around the countryside with a bunch of rotting corpses in tow.  Quickly you dismiss your small army, which instantly collapses back to death and you run to the nearest settlement.  You get to the town of Selawag, which is part of the Brot Kingdom. You enter an inn there with no problems. It would appear that the news of what’s happened hasn’t traveled here yet, but you know it won’t be long. And then how long will it be before someone finds out that you were involved? You suppose it’s possible that you could escape without suspicion, but it’s unlikely. The hunters always find out. They always know.  And life on the run, is what you have to look forward to now. You’ll have to constantly move, and never rest. You prepare yourself for your new life…  A month passes The Incident of Nuro has finally become well known knowledge. The take over was a failure, but the damage done was severe. A temporal disturbance in the heart of the city has made the entire area unstable as buildings phase in and out of existence. Two of the well known culprits Mr. Demar and Felsa were killed in battle. A third, Trelik escaped and is considered to be at large. Many of the Dark Order were either killed or went into hiding. Demons are running amok all over the countryside and have taken particular interest in the Kingdom of Tulan.  A year passes The Kingdom of Tulan has finally put the sword to every last demon infesting the area. Necromancer Trelik was finally hunted down and killed after he was cornered in a small village that he’d turned into his own personal domain. Most of the demonologist have been caught and hung for their crimes as well. Your name has also come up on the wanted list along with the two remaining necromancers involved: Sebastian and Catalina.  You now keep to the rural locations; many times you barely survive attacks from barbaric orc tribes. Fortunately your skills in necromancy protect you (as well as scare the hell out of the orcs)  Two years pass Nuro has completely collapsed in on itself due to the temporal disturbance leaving nothing but a gaping hole there; a war breaks out in the nearby area.  Sebastian took his own life as the Retlad Guard beat down his door. Catalina was found dead by an unknown assassin. Nobody knows who, but it wasn’t by any government. You have a good idea though, considering you have been attacked several times by vampire assassins during the night.  Two more years pass You hear them coming for you, there is no more running. This is your fate. To die in this cave. You don’t even want to fight it anymore. You regret the day you set out on this path.  Such is often the fate of a necromancer."
7397,57,"“No that’s okay.” You say not wishing to cause trouble. Mr. Demar frowns a bit, but accepts your decision.  “Very well, I guess you’re with me Trelik, and for fuck’s sake don’t be so damn hostile this time. These matters have to be handled with care!”  As they leave to the conference room, you go back to practicing your lessons. While you’re in the middle of them you and the rest of the students soon hear some noise and the sounds of battle.  “DAMN IT TRELIK IF YOU’RE GONNA KILL THE SONOFABITCH, AT LEAST GET IT RIGHT!” you hear Mr. Demar yell.  You and a few of the other student go running toward the conference room, a figure runs at you in flames!  He smashes into you wailing horribly setting you on fire as well, you can’t get him off of you in time before you begin to burn up, but it hardly matters as Trelik soon comes to finish off the vampire delegate…and you as well with another fireball.  “Sorry Mr. Demar, couldn’t be helped.”"
